{
  "id": "docs",
  "type": "site",
  "name": "Acme Docs",
  "baseUrl": "https://docs.example.com",
  "version": "4.2",
  "children": [
    {
      "id": "s-getting-started",
      "type": "section",
      "name": "Getting started",
      "children": [
        {
          "id": "install",
          "type": "page",
          "name": "Install",
          "file": "getting-started/install.md",
          "status": "published"
        },
        {
          "id": "quick-start",
          "type": "page",
          "name": "Quick start",
          "file": "getting-started/quick-start.md",
          "status": "published"
        },
        {
          "id": "project-layout",
          "type": "page",
          "name": "Project layout",
          "file": "getting-started/project-layout.md",
          "status": "published"
        },
        {
          "id": "configuration",
          "type": "page",
          "name": "Configuration",
          "file": "getting-started/configuration.md",
          "status": "review"
        },
        {
          "id": "upgrading",
          "type": "page",
          "name": "Upgrading",
          "file": "getting-started/upgrading.md",
          "status": "draft"
        }
      ]
    },
    {
      "id": "s-guides",
      "type": "section",
      "name": "Guides",
      "children": [
        {
          "id": "s-authentication",
          "type": "section",
          "name": "Authentication",
          "collapsed": true,
          "children": [
            {
              "id": "authentication-overview",
              "type": "page",
              "name": "Authentication: overview",
              "file": "guides/authentication/overview.md",
              "status": "published"
            },
            {
              "id": "authentication-examples",
              "type": "page",
              "name": "Authentication: examples",
              "file": "guides/authentication/examples.md",
              "status": "published"
            },
            {
              "id": "authentication-options",
              "type": "page",
              "name": "Authentication: options",
              "file": "guides/authentication/options.md",
              "status": "published"
            },
            {
              "id": "authentication-limits",
              "type": "page",
              "name": "Authentication: limits",
              "file": "guides/authentication/limits.md",
              "status": "review"
            }
          ]
        },
        {
          "id": "s-routing",
          "type": "section",
          "name": "Routing",
          "collapsed": true,
          "children": [
            {
              "id": "routing-overview",
              "type": "page",
              "name": "Routing: overview",
              "file": "guides/routing/overview.md",
              "status": "draft"
            },
            {
              "id": "routing-examples",
              "type": "page",
              "name": "Routing: examples",
              "file": "guides/routing/examples.md",
              "status": "published"
            },
            {
              "id": "routing-options",
              "type": "page",
              "name": "Routing: options",
              "file": "guides/routing/options.md",
              "status": "published"
            },
            {
              "id": "routing-limits",
              "type": "page",
              "name": "Routing: limits",
              "file": "guides/routing/limits.md",
              "status": "published"
            }
          ]
        },
        {
          "id": "s-data-fetching",
          "type": "section",
          "name": "Data fetching",
          "collapsed": true,
          "children": [
            {
              "id": "data-fetching-overview",
              "type": "page",
              "name": "Data fetching: overview",
              "file": "guides/data-fetching/overview.md",
              "status": "review"
            },
            {
              "id": "data-fetching-examples",
              "type": "page",
              "name": "Data fetching: examples",
              "file": "guides/data-fetching/examples.md",
              "status": "draft"
            },
            {
              "id": "data-fetching-options",
              "type": "page",
              "name": "Data fetching: options",
              "file": "guides/data-fetching/options.md",
              "status": "published"
            },
            {
              "id": "data-fetching-limits",
              "type": "page",
              "name": "Data fetching: limits",
              "file": "guides/data-fetching/limits.md",
              "status": "published"
            }
          ]
        },
        {
          "id": "s-caching",
          "type": "section",
          "name": "Caching",
          "collapsed": true,
          "children": [
            {
              "id": "caching-overview",
              "type": "page",
              "name": "Caching: overview",
              "file": "guides/caching/overview.md",
              "status": "published"
            },
            {
              "id": "caching-examples",
              "type": "page",
              "name": "Caching: examples",
              "file": "guides/caching/examples.md",
              "status": "review"
            },
            {
              "id": "caching-options",
              "type": "page",
              "name": "Caching: options",
              "file": "guides/caching/options.md",
              "status": "draft"
            },
            {
              "id": "caching-limits",
              "type": "page",
              "name": "Caching: limits",
              "file": "guides/caching/limits.md",
              "status": "published"
            }
          ]
        },
        {
          "id": "s-forms",
          "type": "section",
          "name": "Forms",
          "collapsed": true,
          "children": [
            {
              "id": "forms-overview",
              "type": "page",
              "name": "Forms: overview",
              "file": "guides/forms/overview.md",
              "status": "published"
            },
            {
              "id": "forms-examples",
              "type": "page",
              "name": "Forms: examples",
              "file": "guides/forms/examples.md",
              "status": "published"
            },
            {
              "id": "forms-options",
              "type": "page",
              "name": "Forms: options",
              "file": "guides/forms/options.md",
              "status": "review"
            },
            {
              "id": "forms-limits",
              "type": "page",
              "name": "Forms: limits",
              "file": "guides/forms/limits.md",
              "status": "draft"
            }
          ]
        },
        {
          "id": "s-file-uploads",
          "type": "section",
          "name": "File uploads",
          "collapsed": true,
          "children": [
            {
              "id": "file-uploads-overview",
              "type": "page",
              "name": "File uploads: overview",
              "file": "guides/file-uploads/overview.md",
              "status": "published"
            },
            {
              "id": "file-uploads-examples",
              "type": "page",
              "name": "File uploads: examples",
              "file": "guides/file-uploads/examples.md",
              "status": "published"
            },
            {
              "id": "file-uploads-options",
              "type": "page",
              "name": "File uploads: options",
              "file": "guides/file-uploads/options.md",
              "status": "published"
            },
            {
              "id": "file-uploads-limits",
              "type": "page",
              "name": "File uploads: limits",
              "file": "guides/file-uploads/limits.md",
              "status": "review"
            }
          ]
        },
        {
          "id": "s-background-jobs",
          "type": "section",
          "name": "Background jobs",
          "collapsed": true,
          "children": [
            {
              "id": "background-jobs-overview",
              "type": "page",
              "name": "Background jobs: overview",
              "file": "guides/background-jobs/overview.md",
              "status": "draft"
            },
            {
              "id": "background-jobs-examples",
              "type": "page",
              "name": "Background jobs: examples",
              "file": "guides/background-jobs/examples.md",
              "status": "published"
            },
            {
              "id": "background-jobs-options",
              "type": "page",
              "name": "Background jobs: options",
              "file": "guides/background-jobs/options.md",
              "status": "published"
            },
            {
              "id": "background-jobs-limits",
              "type": "page",
              "name": "Background jobs: limits",
              "file": "guides/background-jobs/limits.md",
              "status": "published"
            }
          ]
        },
        {
          "id": "s-deploying",
          "type": "section",
          "name": "Deploying",
          "collapsed": true,
          "children": [
            {
              "id": "deploying-overview",
              "type": "page",
              "name": "Deploying: overview",
              "file": "guides/deploying/overview.md",
              "status": "review"
            },
            {
              "id": "deploying-examples",
              "type": "page",
              "name": "Deploying: examples",
              "file": "guides/deploying/examples.md",
              "status": "draft"
            },
            {
              "id": "deploying-options",
              "type": "page",
              "name": "Deploying: options",